<?xml version="1.0" encoding="UTF-8"?>
<Hotels xmlns:xsi="http://www.w3.org/2001/XMLSchema-instance" xsi:noNamespaceSchemaLocation="Hotels.xsd">
  <Hotel chain="WestinChain">
    <Name>Westin</Name>
    <Address NearestAirport="Sky Harbor">
      <Number>11</Number>
      <Street>E 7th St</Street>
      <City>Tempe</City>
      <State>AZ</State>
      <Zip>85281</Zip>
    </Address>
    <Phone>480-968-8885</Phone>
    <Phone>800-937-8461</Phone>
    <Rating>4.2</Rating>
  </Hotel>
  <Hotel>
    <Name>Marriott</Name>
    <Address NearestAirport="Sky Harbor">
      <Number>2000</Number>
      <Street>Plaza Level</Street>
      <City>Phoenix</City>
      <State>AZ</State>
      <Zip>85034</Zip>
    </Address>
    <Phone>602-943-6600</Phone>
  </Hotel>
  <Hotel chain="HiltonChain">
    <Name>Hilton</Name>
    <Address NearestAirport="Sky Harbor">
      <Number>5400</Number>
      <Street>W Chandler Blvd</Street>
      <City>Chandler</City>
      <State>AZ</State>
      <Zip>85226</Zip>
    </Address>
    <Phone>480-706-8800</Phone>
    <Rating>4.0</Rating>
  </Hotel>
</Hotels>
